{
  "format": "nebula-layout",
  "version": 2,
  "meta": {
    "name": "GTA V · on foot, vehicle, aircraft",
    "author": "Nebula",
    "game": {
      "name": "Grand Theft Auto V",
      "steamAppId": 271590
    },
    "target": "xinput",
    "device": "phone",
    "aspect": 2.17,
    "description": "Five touch layouts on GTA V's own controller map, switched from the top centre. On foot: move with sprint and run lock, fire on both sides, aim, jump, cover, stealth, wheel, next/prev weapon, look behind, phone, characters, special ability, interaction menu. Vehicle: analog steering, gas and brake pedals, handbrake, horn/boost, lights, radio, cinematic camera, drive-by, vehicle weapon. Aircraft: flight stick, throttle, yaw, fire, gear, VTOL. Parachute and phone too.",
    "tags": [
      "action-adventure",
      "third-person",
      "shooter",
      "controller",
      "touch-only"
    ]
  },
  "set": {
    "start": "on-foot",
    "cycle": [
      "on-foot",
      "vehicle",
      "aircraft"
    ]
  },
  "layouts": [
    {
      "id": "on-foot",
      "name": "On foot",
      "settings": {
        "outside": "look",
        "look": "mouse"
      },
      "landscape": [
        {
          "id": "move",
          "kind": "zone",
          "x": 0.22,
          "y": 0.62,
          "w": 0.44,
          "h": 0.76,
          "label": "Move",
          "shape": "square",
          "zone": "floating_stick",
          "role": "move",
          "deadzone": 0.1,
          "opacity": 0.25,
          "runLock": true,
          "sprint": "pad:4096"
        },
        {
          "id": "fire-left",
          "kind": "trigger",
          "x": 0.075,
          "y": 0.36,
          "w": 60,
          "h": 60,
          "label": "FIRE",
          "bindings": [
            "rt"
          ],
          "role": "fire"
        },
        {
          "id": "fire",
          "kind": "trigger",
          "x": 0.8,
          "y": 0.56,
          "w": 80,
          "h": 80,
          "label": "FIRE",
          "bindings": [
            "rt"
          ],
          "role": "fire",
          "lookThrough": true
        },
        {
          "id": "aim",
          "kind": "trigger",
          "x": 0.925,
          "y": 0.34,
          "w": 60,
          "h": 60,
          "label": "AIM",
          "bindings": [
            "lt"
          ],
          "role": "ads",
          "mode": "mixed"
        },
        {
          "id": "jump",
          "kind": "button",
          "x": 0.905,
          "y": 0.6,
          "w": 54,
          "h": 54,
          "label": "Jump",
          "bindings": [
            "pad:16384"
          ],
          "role": "jump"
        },
        {
          "id": "stealth",
          "kind": "button",
          "x": 0.905,
          "y": 0.84,
          "w": 52,
          "h": 52,
          "label": "Stealth",
          "bindings": [
            "pad:64"
          ],
          "role": "crouch"
        },
        {
          "id": "reload",
          "kind": "button",
          "x": 0.69,
          "y": 0.88,
          "w": 50,
          "h": 50,
          "label": "Reload",
          "bindings": [
            "pad:8192"
          ],
          "role": "reload"
        },
        {
          "id": "enter",
          "kind": "button",
          "x": 0.615,
          "y": 0.66,
          "w": 50,
          "h": 50,
          "label": "Enter",
          "bindings": [
            "pad:32768"
          ],
          "role": "interact"
        },
        {
          "id": "wheel",
          "kind": "button",
          "x": 0.585,
          "y": 0.88,
          "w": 48,
          "h": 48,
          "label": "Wheel",
          "bindings": [
            "pad:256"
          ],
          "role": "switch"
        },
        {
          "id": "cover",
          "kind": "button",
          "x": 0.63,
          "y": 0.4,
          "w": 50,
          "h": 50,
          "label": "Cover",
          "bindings": [
            "pad:512"
          ]
        },
        {
          "id": "prev",
          "kind": "button",
          "x": 0.74,
          "y": 0.28,
          "w": 50,
          "h": 34,
          "label": "Prev",
          "bindings": [
            "pad:4"
          ],
          "shape": "pill"
        },
        {
          "id": "next",
          "kind": "button",
          "x": 0.84,
          "y": 0.28,
          "w": 50,
          "h": 34,
          "label": "Next",
          "bindings": [
            "pad:8"
          ],
          "shape": "pill"
        },
        {
          "id": "to-vehicle",
          "kind": "switch",
          "x": 0.53,
          "y": 0.76,
          "w": 56,
          "h": 34,
          "label": "Drive",
          "shape": "pill",
          "switchTo": "layout:vehicle"
        },
        {
          "id": "phone",
          "kind": "button",
          "x": 0.05,
          "y": 0.075,
          "w": 56,
          "h": 34,
          "label": "Phone",
          "bindings": [
            "pad:1"
          ],
          "shape": "pill"
        },
        {
          "id": "to-phone",
          "kind": "switch",
          "x": 0.13,
          "y": 0.075,
          "w": 56,
          "h": 34,
          "label": "Keys",
          "shape": "pill",
          "switchTo": "layout:phone"
        },
        {
          "id": "chars",
          "kind": "button",
          "x": 0.21,
          "y": 0.075,
          "w": 66,
          "h": 34,
          "label": "Map/Chars",
          "bindings": [
            "pad:2"
          ],
          "shape": "pill"
        },
        {
          "id": "cam",
          "kind": "button",
          "x": 0.4,
          "y": 0.075,
          "w": 56,
          "h": 34,
          "label": "Cam",
          "bindings": [
            "pad:32"
          ],
          "shape": "pill"
        },
        {
          "id": "switch",
          "kind": "switch",
          "x": 0.5,
          "y": 0.075,
          "w": 84,
          "h": 34,
          "shape": "pill",
          "switchTo": "picker"
        },
        {
          "id": "pause",
          "kind": "button",
          "x": 0.6,
          "y": 0.075,
          "w": 56,
          "h": 34,
          "label": "Pause",
          "bindings": [
            "pad:16"
          ],
          "shape": "pill"
        },
        {
          "id": "interact",
          "kind": "macro",
          "x": 0.72,
          "y": 0.075,
          "w": 62,
          "h": 34,
          "label": "Menu",
          "steps": [
            {
              "binding": "pad:32",
              "holdMs": 800
            }
          ],
          "shape": "pill"
        },
        {
          "id": "special",
          "kind": "button",
          "x": 0.8,
          "y": 0.075,
          "w": 62,
          "h": 34,
          "label": "Special",
          "bindings": [
            "pad:64",
            "pad:128"
          ],
          "shape": "pill"
        },
        {
          "id": "behind",
          "kind": "button",
          "x": 0.955,
          "y": 0.1,
          "w": 44,
          "h": 44,
          "label": "Behind",
          "bindings": [
            "pad:128"
          ]
        }
      ],
      "portrait": [
        {
          "id": "move",
          "kind": "zone",
          "x": 0.25,
          "y": 0.78,
          "w": 0.5,
          "h": 0.42,
          "label": "Move",
          "shape": "square",
          "zone": "floating_stick",
          "role": "move",
          "deadzone": 0.1,
          "opacity": 0.25,
          "runLock": true,
          "sprint": "pad:4096"
        },
        {
          "id": "fire-left",
          "kind": "trigger",
          "x": 0.1,
          "y": 0.61,
          "w": 52,
          "h": 52,
          "label": "FIRE",
          "bindings": [
            "rt"
          ],
          "role": "fire"
        },
        {
          "id": "fire",
          "kind": "trigger",
          "x": 0.72,
          "y": 0.78,
          "w": 72,
          "h": 72,
          "label": "FIRE",
          "bindings": [
            "rt"
          ],
          "role": "fire",
          "lookThrough": true
        },
        {
          "id": "aim",
          "kind": "trigger",
          "x": 0.9,
          "y": 0.63,
          "w": 54,
          "h": 54,
          "label": "AIM",
          "bindings": [
            "lt"
          ],
          "role": "ads",
          "mode": "mixed"
        },
        {
          "id": "jump",
          "kind": "button",
          "x": 0.9,
          "y": 0.8,
          "w": 50,
          "h": 50,
          "label": "Jump",
          "bindings": [
            "pad:16384"
          ],
          "role": "jump"
        },
        {
          "id": "stealth",
          "kind": "button",
          "x": 0.9,
          "y": 0.94,
          "w": 46,
          "h": 46,
          "label": "Stealth",
          "bindings": [
            "pad:64"
          ],
          "role": "crouch"
        },
        {
          "id": "reload",
          "kind": "button",
          "x": 0.72,
          "y": 0.94,
          "w": 44,
          "h": 44,
          "label": "Reload",
          "bindings": [
            "pad:8192"
          ],
          "role": "reload"
        },
        {
          "id": "enter",
          "kind": "button",
          "x": 0.56,
          "y": 0.7,
          "w": 46,
          "h": 46,
          "label": "Enter",
          "bindings": [
            "pad:32768"
          ],
          "role": "interact"
        },
        {
          "id": "cover",
          "kind": "button",
          "x": 0.56,
          "y": 0.81,
          "w": 44,
          "h": 44,
          "label": "Cover",
          "bindings": [
            "pad:512"
          ]
        },
        {
          "id": "wheel",
          "kind": "button",
          "x": 0.56,
          "y": 0.93,
          "w": 44,
          "h": 44,
          "label": "Wheel",
          "bindings": [
            "pad:256"
          ],